product_name,product_asin,product_price,product_ratings,product_ratings_num,product_link,product_image
"Amazon Fresh Colombia Whole Bean Coffee, Medium Roast, 32 Ounce",B071WWCVJV,14.51,4.3 out of 5 stars,"29,625",https://www.amazon.com/sspa/click?ie=UTF8&spc=MToyOTI3MzY4MTg1MTMwMjE5OjE2OTE5NzAxMDQ6c3BfYXRmOjIwMDAxMDUyMTczODQzMTo6MDo6&url=%2FAmazonFresh-Colombia-Whole-Coffee-Medium%2Fdp%2FB071WWCVJV%2Fref%3Dsr_1_1_ffob_sspa%3Fkeywords%3Dcoffee%2Bbeans%26qid%3D1691970104%26sr%3D8-1-spons%26sp_csd%3Dd2lkZ2V0TmFtZT1zcF9hdGY%26psc%3D1,https://m.media-amazon.com/images/I/7121M8H6isL._AC_UL400_.jpg
Starbucks Medium Roast Whole Bean Coffee — Breakfast Blend — 100% Arabica — 1 bag (18 oz),B09366FYN2,13.92,4.7 out of 5 stars,"57,817",https://www.amazon.com/sspa/click?ie=UTF8&spc=MToyOTI3MzY4MTg1MTMwMjE5OjE2OTE5NzAxMDQ6c3BfYXRmOjIwMDA0NzkyMTAyMTA5ODo6MDo6&url=%2FStarbucks-Medium-Roast-Whole-Coffee%2Fdp%2FB09366FYN2%2Fref%3Dsr_1_2_sspa%3Fkeywords%3Dcoffee%2Bbeans%26qid%3D1691970104%26rdc%3D1%26sr%3D8-2-spons%26sp_csd%3Dd2lkZ2V0TmFtZT1zcF9hdGY%26psc%3D1,https://m.media-amazon.com/images/I/71fa8o44KyL._AC_UL400_.jpg
"Lavazza Espresso Italiano Whole Bean Coffee Blend, Medium Roast, 2.2 Pound Bag (Packaging May Vary) Premium Quality, Non GMO, 100% Arabica, Rich bodied",B00P0ZMWEC,14.49,4.5 out of 5 stars,"74,152",https://www.amazon.com/sspa/click?ie=UTF8&spc=MToyOTI3MzY4MTg1MTMwMjE5OjE2OTE5NzAxMDQ6c3BfYXRmOjIwMDA4NTE0MzA5NzY0MTo6MDo6&url=%2FLavazza-Espresso-Coffee-Medium-2-2-Pound%2Fdp%2FB00P0ZMWEC%2Fref%3Dsr_1_3_sspa%3Fkeywords%3Dcoffee%2Bbeans%26qid%3D1691970104%26sr%3D8-3-spons%26sp_csd%3Dd2lkZ2V0TmFtZT1zcF9hdGY%26psc%3D1,https://m.media-amazon.com/images/I/51QSM56MTGL._AC_UL400_.jpg
"Lavazza Espresso Italiano Whole Bean Coffee Blend, Medium Roast, 2.2 Pound Bag (Packaging may vary) Premium Quality Arabic",B016RY0LWO,14.49,4.7 out of 5 stars,"2,295",https://www.amazon.com/sspa/click?ie=UTF8&spc=MToyOTI3MzY4MTg1MTMwMjE5OjE2OTE5NzAxMDQ6c3BfYXRmOjIwMDA2MDAyODY3Mjg5ODo6MDo6&url=%2FLavazza-Espresso-Coffee-Medium-2-2-Pound%2Fdp%2FB016RY0LWO%2Fref%3Dsr_1_4_sspa%3Fkeywords%3Dcoffee%2Bbeans%26qid%3D1691970104%26sr%3D8-4-spons%26sp_csd%3Dd2lkZ2V0TmFtZT1zcF9hdGY%26psc%3D1,https://m.media-amazon.com/images/I/51nrzsNZevL._AC_UL400_.jpg
"Amazon Fresh Colombia Whole Bean Coffee, Medium Roast, 32 Ounce",B071WWCVJV,14.51,4.3 out of 5 stars,"29,625",https://www.amazon.com/AmazonFresh-Colombia-Whole-Coffee-Medium/dp/B071WWCVJV/ref=sr_1_5?keywords=coffee+beans&qid=1691970104&sr=8-5,https://m.media-amazon.com/images/I/7121M8H6isL._AC_UL400_.jpg
"Lavazza Espresso Barista Gran Crema Whole Bean Coffee Blend, Medium Espresso Roast, Oz Bag (Packaging May Vary) - 2.2 LB, 35.2 Ounce",B005OJ4X32,14.49,4.5 out of 5 stars,"74,152",https://www.amazon.com/Lavazza-Coffee-Medium-Espresso-2-2-Pound/dp/B005OJ4X32/ref=sr_1_6?keywords=coffee+beans&qid=1691970104&sr=8-6,https://m.media-amazon.com/images/I/61zJFyE6NNL._AC_UL400_.jpg
"Cameron's Coffee Roasted Whole Bean Coffee, Breakfast Blend, 32 Ounce",B006Y7WAHE,9.98,4.6 out of 5 stars,"3,604",https://www.amazon.com/Camerons-Coffee-Roasted-Whole-Breakfast/dp/B006Y7WAHE/ref=sr_1_7?keywords=coffee+beans&qid=1691970104&sr=8-7,https://m.media-amazon.com/images/I/61FFO9a0vWL._AC_UL400_.jpg
"Tim Hortons Whole Bean Original, Medium Roast Coffee, Made with 100% Arabica Beans, 12 Ounce Bag",B00N23MY74,5.98,4.6 out of 5 stars,"2,755",https://www.amazon.com/Tim-Hortons-Arabica-Medium-Original/dp/B00N23MY74/ref=sr_1_8?keywords=coffee+beans&qid=1691970104&sr=8-8,https://m.media-amazon.com/images/I/71vok50fMsL._AC_UL400_.jpg
"Lavazza Espresso Italiano Whole Bean Coffee Blend, Medium Roast, 2.2 Pound Bag (Packaging may vary) Premium Quality Arabic",B016RY0LWO,14.49,4.7 out of 5 stars,"2,295",https://www.amazon.com/Lavazza-Espresso-Coffee-Medium-2-2-Pound/dp/B016RY0LWO/ref=sr_1_9?keywords=coffee+beans&qid=1691970104&sr=8-9,https://m.media-amazon.com/images/I/51nrzsNZevL._AC_UL400_.jpg
"Copper Moon Whole Bean Coffee, Dark Roast, Sumatra Blend, 2 Lb",B01L9YE808,16.98,4.4 out of 5 stars,"6,173",https://www.amazon.com/Copper-Moon-Sumatra-Smoothly-Full-Bodied/dp/B01L9YE808/ref=sr_1_10?keywords=coffee+beans&qid=1691970104&sr=8-10,https://m.media-amazon.com/images/I/71tghw+pMBL._AC_UL400_.jpg
"AmazonFresh Organic Fair Trade Sumatra Whole Bean Coffee, Dark Roast, 12 Ounce",B072MQFGHG,9.44,4.3 out of 5 stars,"29,625",https://www.amazon.com/sspa/click?ie=UTF8&spc=MToyOTI3MzY4MTg1MTMwMjE5OjE2OTE5NzAxMDQ6c3BfbXRmOjIwMDAxMzM3MTQwNjYyMTo6MDo6&url=%2FAmazonFresh-Organic-Trade-Sumatra-Coffee%2Fdp%2FB072MQFGHG%2Fref%3Dsr_1_11_ffob_sspa%3Fkeywords%3Dcoffee%2Bbeans%26qid%3D1691970104%26sr%3D8-11-spons%26sp_csd%3Dd2lkZ2V0TmFtZT1zcF9tdGY%26psc%3D1,https://m.media-amazon.com/images/I/81VE86P+G1L._AC_UL400_.jpg
DEATH WISH COFFEE Whole Bean Coffee Dark Roast - Extra Kick of Caffeine - USA Organic Coffee Beans Bundle/Bulk - Fair Trade Arabica & Robusta Coffee - Real Dark Roast Coffee Beans (16 oz),B006CNTR6W,17.48,4.6 out of 5 stars,"18,637",https://www.amazon.com/sspa/click?ie=UTF8&spc=MToyOTI3MzY4MTg1MTMwMjE5OjE2OTE5NzAxMDQ6c3BfbXRmOjIwMDA3MzE2MDc4MDM1MTo6MDo6&url=%2FDeath-Wish-Organic-Certified-Coffee%2Fdp%2FB006CNTR6W%2Fref%3Dsr_1_12_sspa%3Fkeywords%3Dcoffee%2Bbeans%26qid%3D1691970104%26sr%3D8-12-spons%26sp_csd%3Dd2lkZ2V0TmFtZT1zcF9tdGY%26psc%3D1%26smid%3DA3FFNGPA34M6B1,https://m.media-amazon.com/images/I/61+OtZZtI4L._AC_UL400_.jpg
"5 lb Coffee Beans - Whole Bean Coffee Medium Roast - Gourmet Coffee, Fresh Roasted Coffee, 5 Pound (5lb) Bag By Olde Brooklyn Coffee",B07S4BZ7Q1,39.99,4.4 out of 5 stars,"1,494",https://www.amazon.com/sspa/click?ie=UTF8&spc=MToyOTI3MzY4MTg1MTMwMjE5OjE2OTE5NzAxMDQ6c3BfbXRmOjIwMDA0MjUzMjIxMTQ5ODo6MDo6&url=%2FMedium-Roast-Whole-Bean-Coffee%2Fdp%2FB07S4BZ7Q1%2Fref%3Dsr_1_13_sspa%3Fkeywords%3Dcoffee%2Bbeans%26qid%3D1691970104%26sr%3D8-13-spons%26sp_csd%3Dd2lkZ2V0TmFtZT1zcF9tdGY%26psc%3D1,https://m.media-amazon.com/images/I/61QsQ9GOstL._AC_UL400_.jpg
"Cameron's Coffee Roasted Whole Bean Coffee, Breakfast Blend, 32 Ounce",B006Y7WAHE,9.98,4.6 out of 5 stars,"3,604",https://www.amazon.com/sspa/click?ie=UTF8&spc=MToyOTI3MzY4MTg1MTMwMjE5OjE2OTE5NzAxMDQ6c3BfbXRmOjIwMDA2NTc4NjEzNzA3MTo6MDo6&url=%2FCamerons-Coffee-Roasted-Whole-Breakfast%2Fdp%2FB006Y7WAHE%2Fref%3Dsr_1_14_sspa%3Fkeywords%3Dcoffee%2Bbeans%26qid%3D1691970104%26sr%3D8-14-spons%26sp_csd%3Dd2lkZ2V0TmFtZT1zcF9tdGY%26psc%3D1,https://m.media-amazon.com/images/I/61FFO9a0vWL._AC_UL400_.jpg
"San Francisco Bay Whole Bean Coffee - Breakfast Blend (2lb Bag), Medium Roast",B003KKALAQ,21.99,4.4 out of 5 stars,"20,059",https://www.amazon.com/Francisco-Coffee-Breakfast-Blend-2-Pound/dp/B003KKALAQ/ref=sr_1_15?keywords=coffee+beans&qid=1691970104&rdc=1&sr=8-15,https://m.media-amazon.com/images/I/61SHmbuyNYS._AC_UL400_.jpg
"Kauai Whole Bean Coffee, Koloa Estate Medium Roast - Arabica Whole Bean Coffee from Hawaii’s Largest Coffee Grower - Bright Aroma with Light Floral Notes - 32 Ounce",B00AD60574,25.99,4.4 out of 5 stars,"5,706",https://www.amazon.com/Kauai-Whole-Coffee-Estate-Medium/dp/B00AD60574/ref=sr_1_16?keywords=coffee+beans&qid=1691970104&sr=8-16,https://m.media-amazon.com/images/I/71kPGY6XXxL._AC_UL400_.jpg
"Stumptown Coffee Roasters, Medium Roast Organic Whole Bean Coffee - Founder's Blend 12 Ounce Bag with Flavor Notes of Vanilla and Cocoa Powder",B076ZZGHPH,14.98,4.2 out of 5 stars,"8,920",https://www.amazon.com/Stumptown-Coffee-Roasters-Founders-Full-Bodied/dp/B076ZZGHPH/ref=sr_1_17?keywords=coffee+beans&qid=1691970104&rdc=1&sr=8-17,https://m.media-amazon.com/images/I/819x53bNfyL._AC_UL400_.jpg
"Mt. Comfort Coffee Organic Peru Medium Roast, 2.5 lb Bag - Flavor Notes of Nutty, Chocolate, & Citrus - Sourced From Small, Peruvian Coffee Farms - Roasted Whole Beans",B07171HMF5,23.45,4.4 out of 5 stars,"1,714",https://www.amazon.com/Mount-Comfort-Coffee-Organic-Whole/dp/B07171HMF5/ref=sr_1_18?keywords=coffee+beans&qid=1691970104&sr=8-18,https://m.media-amazon.com/images/I/61HIOlsrTYL._AC_UL400_.jpg
"Lavazza Super Crema Whole Bean Coffee Blend, Medium Espresso Roast, Pack of 2",B07PPV796X,35.00,4.6 out of 5 stars,"5,624",https://www.amazon.com/sspa/click?ie=UTF8&spc=MToyOTI3MzY4MTg1MTMwMjE5OjE2OTE5NzAxMDQ6c3BfbXRmOjIwMDA4MDc4NTg0NzU5ODo6MDo6&url=%2FLavazza-4202A-Pound-Espresso-2-Pack%2Fdp%2FB07PPV796X%2Fref%3Dsr_1_19_sspa%3Fkeywords%3Dcoffee%2Bbeans%26qid%3D1691970104%26sr%3D8-19-spons%26sp_csd%3Dd2lkZ2V0TmFtZT1zcF9tdGY%26psc%3D1,https://m.media-amazon.com/images/I/61c+5gf8AGL._AC_UL400_.jpg
"Java Planet Low Acid Coffee, Organic Colombian Single Origin: Whole Bean Medium Dark Roast - Smooth Full Flavored Coffee Bean, Two 1LB Bags",B010KOIRW8,40.98,4.4 out of 5 stars,"5,760",https://www.amazon.com/sspa/click?ie=UTF8&spc=MToyOTI3MzY4MTg1MTMwMjE5OjE2OTE5NzAxMDQ6c3BfbXRmOjIwMDE0NDAyNjAxNjk5ODo6MDo6&url=%2FJava-Planet-Colombian-Alliance-Specialty%2Fdp%2FB010KOIRW8%2Fref%3Dsr_1_20_sspa%3Fkeywords%3Dcoffee%2Bbeans%26qid%3D1691970104%26sr%3D8-20-spons%26sp_csd%3Dd2lkZ2V0TmFtZT1zcF9tdGY%26psc%3D1,https://m.media-amazon.com/images/I/71a4GlsJVhL._AC_UL400_.jpg
"Real Good Coffee Company - Whole Bean Coffee - Donut Shop Medium Roast Coffee Beans - 2 Pound Bag - 100% Whole Arabica Beans - Grind at Home, Brew How You Like",B01N4JBH3X,27.99,4.4 out of 5 stars,"4,665",https://www.amazon.com/sspa/click?ie=UTF8&spc=MToyOTI3MzY4MTg1MTMwMjE5OjE2OTE5NzAxMDQ6c3BfbXRmOjIwMDA5ODMyNDMzNTU5ODo6MDo6&url=%2FReal-Good-Coffee-Medium-Arabica%2Fdp%2FB01N4JBH3X%2Fref%3Dsr_1_21_sspa%3Fkeywords%3Dcoffee%2Bbeans%26qid%3D1691970104%26sr%3D8-21-spons%26sp_csd%3Dd2lkZ2V0TmFtZT1zcF9tdGY%26psc%3D1,https://m.media-amazon.com/images/I/71Z2vtL1MVL._AC_UL400_.jpg
Bones Coffee Company Colombia Single-Origin Flavored Whole Coffee Beans New Packaging | 12 oz Medium Roast Low Acid Coffee | Coffee Gifts & Beverages (Whole Bean),B07TBP4TPC,17.99,4.5 out of 5 stars,"12,828",https://www.amazon.com/sspa/click?ie=UTF8&spc=MToyOTI3MzY4MTg1MTMwMjE5OjE2OTE5NzAxMDQ6c3BfbXRmOjIwMDE1NzMxODg2Mzk5ODo6MDo6&url=%2FBones-Coffee-Company-Colombia-Single-Origin%2Fdp%2FB07TBP4TPC%2Fref%3Dsr_1_22_sspa%3Fkeywords%3Dcoffee%2Bbeans%26qid%3D1691970104%26sr%3D8-22-spons%26sp_csd%3Dd2lkZ2V0TmFtZT1zcF9tdGY%26psc%3D1,https://m.media-amazon.com/images/I/71kPHVWlxML._AC_UL400_.jpg
Don Francisco's Kona Blend Whole Bean Coffee (18 oz Bag),B0BJ117V7X,13.48,4.7 out of 5 stars,393,https://www.amazon.com/Don-Franciscos-Blend-Whole-Coffee/dp/B0BJ117V7X/ref=sr_1_23?keywords=coffee+beans&qid=1691970104&sr=8-23,https://m.media-amazon.com/images/I/61YnPPOJrSL._AC_UL400_.jpg
"Peet's Coffee, Dark Roast Whole Bean Coffee - Major Dickason's Blend 10.5 Ounce Bag",B086ZFM5D9,9.98,4.6 out of 5 stars,"6,569",https://www.amazon.com/Peets-Coffee-Major-Dickasons-Blend/dp/B086ZFM5D9/ref=sr_1_24?keywords=coffee+beans&qid=1691970104&sr=8-24,https://m.media-amazon.com/images/I/71a9T+smfeL._AC_UL400_.jpg
"illy Classico Whole Bean Coffee, Medium Roast, Classic Roast with Notes Of Caramel, Orange Blossom and Jasmine, 100% Arabica Coffee, No Preservatives, 8.8 Ounce Can (Pack of 1)",B00112IMUQ,10.65,4.6 out of 5 stars,"6,765",https://www.amazon.com/Classico-Classic-Chocolate-Caramel-Preservatives/dp/B00112IMUQ/ref=sr_1_25?keywords=coffee+beans&qid=1691970104&sr=8-25,https://m.media-amazon.com/images/I/61uhKlDho4L._AC_UL400_.jpg
"Kicking Horse Coffee, Smart Ass, Medium Roast, Whole Bean, 10 oz",B014KG4YZ6,9.99,4.5 out of 5 stars,"6,111",https://www.amazon.com/Kicking-Horse-Coffee-Smart-Medium/dp/B014KG4YZ6/ref=sr_1_26?keywords=coffee+beans&qid=1691970104&sr=8-26,https://m.media-amazon.com/images/I/61xKQrSf2dL._AC_UL400_.jpg
"Eight O'Clock Coffee The Original, 32 Ounce (Pack of 1) Medium Roast Whole Bean Coffee, Sweet, Fruity, Well Balanced",B0BBXS2W2B,14.54,4.6 out of 5 stars,"18,660",https://www.amazon.com/Eight-OClock-Coffee-Original-Certified/dp/B0BBXS2W2B/ref=sr_1_27?keywords=coffee+beans&qid=1691970104&sr=8-27,https://m.media-amazon.com/images/I/71Q5E4TjLaL._AC_UL400_.jpg
"Lavazza Crema e Aroma Whole Bean Coffee Blend, Medium Roast, 2.2-Pound Bag (Pack of 2)",B078TNTB7D,29.99,4.6 out of 5 stars,"5,624",https://www.amazon.com/Lavazza-Crema-Coffee-Medium-2-2-Pound/dp/B078TNTB7D/ref=sr_1_28?keywords=coffee+beans&qid=1691970104&sr=8-28,https://m.media-amazon.com/images/I/81S5UiRUHDL._AC_UL400_.jpg
Starbucks Medium Roast Whole Bean Coffee — Pike Place — 100% Arabica — 1 bag (28 oz),B0959BPLP4,19.24,4.7 out of 5 stars,"57,817",https://www.amazon.com/Starbucks-Medium-Whole-Coffee-Arabica/dp/B0959BPLP4/ref=sr_1_29?keywords=coffee+beans&qid=1691970104&rdc=1&sr=8-29,https://m.media-amazon.com/images/I/61LylUkBjNL._AC_UL400_.jpg
"Hills Bros Dark Satin Whole Bean Coffee, Dark Roast - Arabica Coffee Beans – Full-Bodied Dark Blend Coffee with Bold Flavor, Intensity and a Smooth Finish (32 Oz. Bag)",B007DK90B0,11.48,4.5 out of 5 stars,826,https://www.amazon.com/Hills-Bros-Coffee-Satin-Roast/dp/B007DK90B0/ref=sr_1_30?keywords=coffee+beans&qid=1691970104&sr=8-30,https://m.media-amazon.com/images/I/71715BInuGL._AC_UL400_.jpg
Death Wish Coffee Valhalla Java Odinforce Blend - Whole Bean Dark Roast - Extra Kick of Caffeine - Arabica & Robusta Coffee Beans - Dark Roast Coffee Beans 1 Bag (12oz.),B00FL7J3O6,14.99,4.7 out of 5 stars,"7,097",https://www.amazon.com/Valhalla-Coffee-Death-Wish-Certified/dp/B00FL7J3O6/ref=sr_1_31?keywords=coffee+beans&qid=1691970104&sr=8-31,https://m.media-amazon.com/images/I/61BnSZMLBvL._AC_UL400_.jpg
"Real Good Coffee Company - Whole Bean Coffee - Donut Shop Medium Roast Coffee Beans - 2 Pound Bag - 100% Whole Arabica Beans - Grind at Home, Brew How You Like",B01N4JBH3X,27.99,4.4 out of 5 stars,"4,665",https://www.amazon.com/Real-Good-Coffee-Medium-Arabica/dp/B01N4JBH3X/ref=sr_1_32?keywords=coffee+beans&qid=1691970104&sr=8-32,https://m.media-amazon.com/images/I/71Z2vtL1MVL._AC_UL400_.jpg
"Lavazza Super Crema Espresso medium roast Whole Bean Coffee, 2.2-pound Bag 2-pack",B005D7MCC4,35.99,4.8 out of 5 stars,"3,228",https://www.amazon.com/Lavazza-Espresso-Coffee-2-2-pound-2-pack/dp/B005D7MCC4/ref=sr_1_33?keywords=coffee+beans&qid=1691970104&sr=8-33,https://m.media-amazon.com/images/I/61c+5gf8AGL._AC_UL400_.jpg
"365 by Whole Foods Market, Coffee Pleasant Morning Buzz Whole Bean, 24 Ounce",B074XXNDRC,11.74,4.4 out of 5 stars,"4,153",https://www.amazon.com/365-Everyday-Value-Pleasant-Morning/dp/B074XXNDRC/ref=sr_1_34?keywords=coffee+beans&qid=1691970104&sr=8-34,https://m.media-amazon.com/images/I/61IEzmWRAHL._AC_UL400_.jpg
"Koffee Kult Dark Roast Whole Bean Coffee - Small Batch Gourmet Aromatic Artisan Blend 100% Arabica Coffee Beans Organically Sourced (Dark Roast, 32oz)",B00PV4FG3Q,29.99,4.4 out of 5 stars,"8,482",https://www.amazon.com/Koffee-Kult-Roast-Coffee-Beans/dp/B00PV4FG3Q/ref=sr_1_35?keywords=coffee+beans&qid=1691970104&sr=8-35,https://m.media-amazon.com/images/I/81yekq7Nh6L._AC_UL400_.jpg
Bones Coffee Company S'morey Time Ground Coffee Beans S'mores and Graham Crackers Flavor | 12 oz Medium Roast Low Acid Coffee | Flavored Coffee Gifts & Beverages (Whole Bean),B07TCBG43J,17.99,4.5 out of 5 stars,"12,828",https://www.amazon.com/Bones-Coffee-Company-Smorey-Beans/dp/B07TCBG43J/ref=sr_1_36?keywords=coffee+beans&qid=1691970104&sr=8-36,https://m.media-amazon.com/images/I/717ek3ApioL._AC_UL400_.jpg
"AmazonFresh Organic Fair Trade Sumatra Whole Bean Coffee, Dark Roast, 12 Ounce",B072MQFGHG,9.44,4.3 out of 5 stars,"29,625",https://www.amazon.com/AmazonFresh-Organic-Trade-Sumatra-Coffee/dp/B072MQFGHG/ref=sr_1_37?keywords=coffee+beans&qid=1691970104&sr=8-37,https://m.media-amazon.com/images/I/81VE86P+G1L._AC_UL400_.jpg
"La Colombe Nizza Medium Roast Whole Bean Coffee - 12 Ounce, 1 Pack  - Notes of Milk Chocolate, Nuts & Browniewith a Honey-Sweet Roasted Nuttiness",B00MZXU6CW,12.89,4.4 out of 5 stars,"1,205",https://www.amazon.com/Colombe-Nizza-Whole-Bean-12/dp/B00MZXU6CW/ref=sr_1_38?keywords=coffee+beans&qid=1691970104&sr=8-38,https://m.media-amazon.com/images/I/71ljlu-TA1L._AC_UL400_.jpg
"Black Rifle Coffee Company Silencer Smooth, Whole Bean Coffee, Light Roast Coffee Beans, Light Roast Whole Beans With a Smooth Finish, Helps Support Veterans and First Responders, 12 Ounce Bag",B07DT761GF,17.99,4.7 out of 5 stars,"7,347",https://www.amazon.com/Black-Rifle-Coffee-Company-Silencer/dp/B07DT761GF/ref=sr_1_39?keywords=coffee+beans&qid=1691970104&sr=8-39,https://m.media-amazon.com/images/I/41bjzeVYqOL._AC_UL400_.jpg
"365 by Whole Foods Market, Coffee Pacific Rim Vienna Roast Organic Whole Bean, 24 Ounce",B074XXSSBY,13.43,4.5 out of 5 stars,"2,682",https://www.amazon.com/365-Everyday-Value-Organic-Pacific/dp/B074XXSSBY/ref=sr_1_40?keywords=coffee+beans&qid=1691970104&sr=8-40,https://m.media-amazon.com/images/I/71NQJxDjBVL._AC_UL400_.jpg
"Mayorga Organics Café Cubano, Dark Roast Whole Bean Coffee, 2lbs Bag, Specialty-Grade, 100% USDA Organic, Non-GMO Verified, Direct Trade, Kosher",B00HSRNHHG,23.79,4.6 out of 5 stars,"9,437",https://www.amazon.com/Mayorga-Organics-Specialty-Grade-Organic-Verified/dp/B00HSRNHHG/ref=sr_1_41?keywords=coffee+beans&qid=1691970104&sr=8-41,https://m.media-amazon.com/images/I/61vn79RwheL._AC_UL400_.jpg
"ITALIAN Dark Roast Whole bean – 5 LB Extra Strong Coffee - The World’s Strongest Coffee Beans | Classic Black Coffee, Breakfast, House Gourmet, Italian Espresso- Roasted in New York",B0796G222F,39.99,4.5 out of 5 stars,"3,717",https://www.amazon.com/ROAST-Whole-Coffee-Olde-Brooklyn/dp/B0796G222F/ref=sr_1_42?keywords=coffee+beans&qid=1691970104&sr=8-42,https://m.media-amazon.com/images/I/61CsRqGQ0BL._AC_UL400_.jpg
"Java Planet Low Acid Coffee, Organic Guatemala Single Origin: Whole Bean Medium Roast - Smooth Full Flavored Coffee Bean, Smithsonian Bird Friendly 1LB Bag",B01MDJX8QY,20.99,4.4 out of 5 stars,"5,760",https://www.amazon.com/Java-Planet-Guatemalan-Rainforest-Specialty/dp/B01MDJX8QY/ref=sr_1_43?keywords=coffee+beans&qid=1691970104&sr=8-43,https://m.media-amazon.com/images/I/611G2JKGJDL._AC_UL400_.jpg
"Intelligentsia Coffee, Medium Roast Whole Bean Coffee - Black Cat Espresso 12 Ounce Bag with Flavor Notes of Stone Fruit, Dark Sugars and Dark Chocolate",B0055ZRUOO,13.47,4.1 out of 5 stars,"2,086",https://www.amazon.com/Intelligentsia-Classic-Espresso-Coffee-12-Ounce/dp/B0055ZRUOO/ref=sr_1_44?keywords=coffee+beans&qid=1691970104&rdc=1&sr=8-44,https://m.media-amazon.com/images/I/61ljzJa9oAL._AC_UL400_.jpg
"Guatemala Coffee, Antigua, Whole Bean, Medium Roast, Single Origin, Fresh Roasted, 16-ounces",B0030IEZU0,19.99,4.2 out of 5 stars,"6,917",https://www.amazon.com/Guatemala-Coffee-Antigua-Roasted-16-ounces/dp/B0030IEZU0/ref=sr_1_45?keywords=coffee+beans&qid=1691970104&sr=8-45,https://m.media-amazon.com/images/I/71XvFELSmEL._AC_UL400_.jpg
"Peet's Coffee, Major Dickason's Blend, Dark Roast, Whole Bean 32oz (2 Pack)",B01FEJ8NWI,47.80,4.7 out of 5 stars,700,https://www.amazon.com/Peets-Coffee-Major-Dickasons-Blend/dp/B01FEJ8NWI/ref=sr_1_46?keywords=coffee+beans&qid=1691970104&sr=8-46,https://m.media-amazon.com/images/I/51-OsTfrLoL._AC_UL400_.jpg
"5 lb Coffee Beans - Whole Bean Coffee Medium Roast - Gourmet Coffee, Fresh Roasted Coffee, 5 Pound (5lb) Bag By Olde Brooklyn Coffee",B07S4BZ7Q1,39.99,4.4 out of 5 stars,"1,494",https://www.amazon.com/Medium-Roast-Whole-Bean-Coffee/dp/B07S4BZ7Q1/ref=sr_1_47?keywords=coffee+beans&qid=1691970104&sr=8-47,https://m.media-amazon.com/images/I/61QsQ9GOstL._AC_UL400_.jpg
"Dark Roast Whole Bean Coffee - 5LB Bag For A Classic Black Coffee, Breakfast, House Gourmet, Italian Espresso- Roasted in New York",B07MD6S6Z7,39.99,4.5 out of 5 stars,"3,008",https://www.amazon.com/ROAST-Whole-Coffee-Olde-Brooklyn/dp/B07MD6S6Z7/ref=sr_1_48?keywords=coffee+beans&qid=1691970104&sr=8-48,https://m.media-amazon.com/images/I/61iA+Spb5JL._AC_UL400_.jpg
"Intelligentsia Coffee, Light Roast Whole Bean Coffee - House 12 Ounce Bag with Flavor Notes of Milk Chocolate, Citrus and Apple",B0055ZRUNK,14.99,4.2 out of 5 stars,"1,360",https://www.amazon.com/Intelligentsia-House-Blend-Direct-Coffee/dp/B0055ZRUNK/ref=sr_1_49?keywords=coffee+beans&qid=1691970104&rdc=1&sr=8-49,https://m.media-amazon.com/images/I/61hjdj7bOmL._AC_UL400_.jpg
2 Packs of 40 Oz Starbucks French Roast Whole Bean Coffee = 2 x 40 Oz = 80 Oz,B00G01O8D8,58.99,4.7 out of 5 stars,"1,519",https://www.amazon.com/Packs-Starbucks-French-Roast-Coffee/dp/B00G01O8D8/ref=sr_1_50?keywords=coffee+beans&qid=1691970104&sr=8-50,https://m.media-amazon.com/images/I/811lq3IQA3L._AC_UL400_.jpg
"Real Good Coffee Company - Whole Bean Coffee - Organic Dark Roast Coffee Beans - 2 Pound Bag - 100% Whole Arabica Beans - Grind at Home, Brew How You Like",B073VXYCL4,34.99,4.5 out of 5 stars,"1,621",https://www.amazon.com/Real-Good-Coffee-Certified-Organic/dp/B073VXYCL4/ref=sr_1_51?keywords=coffee+beans&qid=1691970104&sr=8-51,https://m.media-amazon.com/images/I/711c8xpkXBL._AC_UL400_.jpg
"Lavazza Top Class Filtro Whole Bean Coffee Medium Roast 2.2LB Bag ,100% Natural Arabica, Authentic Italian, Blended and roasted in Italy, Milk chocolate and roasted hazelnut aromatic notes",B07XJ8Y52N,25.00,4.5 out of 5 stars,908,https://www.amazon.com/Lavazza-Class-Filtro-Coffee-Medium/dp/B07XJ8Y52N/ref=sr_1_52?keywords=coffee+beans&qid=1691970104&rdc=1&sr=8-52,https://m.media-amazon.com/images/I/71kJrAGebSL._AC_UL400_.jpg
DEATH WISH COFFEE Whole Bean Coffee Dark Roast - Extra Kick of Caffeine - USA Organic Coffee Beans Bundle/Bulk - Fair Trade Arabica & Robusta Coffee - Real Dark Roast Coffee Beans (16 oz),B006CNTR6W,17.48,4.6 out of 5 stars,"18,637",https://www.amazon.com/Death-Wish-Organic-Certified-Coffee/dp/B006CNTR6W/ref=sr_1_53?keywords=coffee+beans&qid=1691970104&sr=8-53,https://m.media-amazon.com/images/I/61+OtZZtI4L._AC_UL400_.jpg
"Wink Blonde Roast Whole Bean Coffee, Large 2.2 Pound Bag, 100% Arabica Coffee Beans, Single Origin Colombian, Smooth, Light, and Complex",B079F9T318,22.99,4.3 out of 5 stars,"2,129",https://www.amazon.com/Wink-Coffee-Colombian-Sustainable-Sourcing/dp/B079F9T318/ref=sr_1_54?keywords=coffee+beans&qid=1691970104&sr=8-54,https://m.media-amazon.com/images/I/71HFpgxhJbL._AC_UL400_.jpg
"Coffee Bean Direct Italian Roast Espresso, Whole Bean Coffee, 5 Pound Bag",B002GWFA1Y,49.00,4.5 out of 5 stars,"1,705",https://www.amazon.com/Coffee-Bean-Direct-Italian-Espresso/dp/B002GWFA1Y/ref=sr_1_55?keywords=coffee+beans&qid=1691970104&sr=8-55,https://m.media-amazon.com/images/I/71heRdNHxPL._AC_UL400_.jpg
"Dunkin' Original Blend Medium Roast Whole Bean Coffee, 12 Ounces (Pack of 6)",B07C55PQLW,49.00,4.8 out of 5 stars,824,https://www.amazon.com/Dunkin-Donuts-Original-Coffee-Medium/dp/B07C55PQLW/ref=sr_1_56?keywords=coffee+beans&qid=1691970104&rdc=1&sr=8-56,https://m.media-amazon.com/images/I/71b3fQhEudL._AC_UL400_.jpg
Danesi Caffe Italian Coffee Beans (Whole Roasted Coffee Beans for Espresso) - Espresso Coffee Beans (Medium Roast Whole Bean) Coffee Bean - Coffee Beans Espresso - Coffee Whole Bean - Classic (2.2lb),B00023J0VU,31.99,4.4 out of 5 stars,631,https://www.amazon.com/Danesi-Caffe-Classic-Espresso-Beans/dp/B00023J0VU/ref=sr_1_57?keywords=coffee+beans&qid=1691970104&sr=8-57,https://m.media-amazon.com/images/I/61oohf8vzwL._AC_UL400_.jpg
"Eight O'Clock Coffee, Original Whole Bean, 42-Ounce Package, Pack of 2",B00ZR9U1GM,47.28,4.6 out of 5 stars,597,https://www.amazon.com/Eight-OClock-Original-42-Ounce-Package/dp/B00ZR9U1GM/ref=sr_1_58?keywords=coffee+beans&qid=1691970104&sr=8-58,https://m.media-amazon.com/images/I/71wCFZ0Yz8L._AC_UL400_.jpg
"BREAKFAST BLEND American Roast Whole Bean Coffee, 5 Lb. Bag By Olde Brooklyn Coffee",B07S49WRM7,39.99,4.5 out of 5 stars,897,https://www.amazon.com/BREAKFAST-BLEND-American-Coffee-Brooklyn/dp/B07S49WRM7/ref=sr_1_59?keywords=coffee+beans&qid=1691970104&sr=8-59,https://m.media-amazon.com/images/I/81y+c8caWSL._AC_UL400_.jpg
Lavazza Qualita Oro Italian Coffee Whole Beans 2lb Pack Of 2,B01E5WT32O,36.99,4.6 out of 5 stars,806,https://www.amazon.com/Lavazza-Qualita-Italian-Coffee-Whole/dp/B01E5WT32O/ref=sr_1_60?keywords=coffee+beans&qid=1691970104&sr=8-60,https://m.media-amazon.com/images/I/41ulho665uL._AC_UL400_.jpg
